{
  "$schema": "http://json-schema.org/draft-07/schema#",
  "$id": "https://babelqueue.com/contracts/message-envelope.schema.json",
  "title": "BabelQueueMessageEnvelope",
  "description": "The canonical, language-agnostic BabelQueue wire envelope (schema_version 1). This schema is authoritative alongside contracts/message-envelope.md.",
  "type": "object",
  "additionalProperties": true,
  "required": ["job", "trace_id", "data", "meta", "attempts"],
  "properties": {
    "job": {
      "type": "string",
      "minLength": 1,
      "description": "The message URN — language-agnostic identity. Canonical producer field name. Consumers also accept 'urn' as an inbound alias. Never a class name.",
      "examples": ["urn:babel:orders:created", "urn:babel:orders:invoice.requested"]
    },
    "urn": {
      "type": "string",
      "minLength": 1,
      "description": "Inbound alias for 'job'. Accepted by consumers for interoperability; producers SHOULD emit 'job'."
    },
    "trace_id": {
      "type": "string",
      "format": "uuid",
      "description": "Cross-service correlation id. Generated by the first producer, preserved and forwarded unchanged by every SDK across every hop."
    },
    "data": {
      "type": "object",
      "description": "Pure, JSON-encodable business payload. No language-specific types. Numbers/time/binary per contracts/message-envelope.md section 6.",
      "additionalProperties": true
    },
    "meta": {
      "type": "object",
      "description": "Producer-set, immutable descriptive metadata.",
      "additionalProperties": true,
      "required": ["id", "queue", "lang", "schema_version", "created_at"],
      "properties": {
        "id": {
          "type": "string",
          "format": "uuid",
          "description": "Unique id for THIS message (distinct from trace_id)."
        },
        "queue": {
          "type": "string",
          "minLength": 1,
          "description": "Logical queue name (not the broker key)."
        },
        "lang": {
          "type": "string",
          "enum": ["php", "go", "python", "java", "dotnet", "node"],
          "description": "Producer language tag."
        },
        "schema_version": {
          "type": "integer",
          "const": 1,
          "description": "Envelope schema version. Consumers MUST reject versions they do not support."
        },
        "created_at": {
          "type": "integer",
          "minimum": 0,
          "description": "Production time as Unix epoch MILLISECONDS, UTC."
        }
      }
    },
    "attempts": {
      "type": "integer",
      "minimum": 0,
      "description": "Top-level transport retry counter, mutated by the broker/worker. Deliberately kept OUT of the immutable meta block."
    },
    "dead_letter": {
      "type": "object",
      "description": "Optional. Present ONLY on messages sitting on a dead-letter queue (ADR-0009). Additive, so it does not change schema_version. Normal consumers ignore it.",
      "additionalProperties": true,
      "required": ["reason", "failed_at", "original_queue", "attempts"],
      "properties": {
        "reason": {
          "type": "string",
          "enum": ["failed", "unknown_urn", "poison"],
          "description": "Why the message was dead-lettered."
        },
        "error": {
          "type": ["string", "null"],
          "description": "Human-readable error message, if any."
        },
        "exception": {
          "type": ["string", "null"],
          "description": "Producer-language exception/type name, if any (informational, language-specific)."
        },
        "failed_at": {
          "type": "integer",
          "minimum": 0,
          "description": "Dead-letter time as Unix epoch milliseconds, UTC."
        },
        "original_queue": {
          "type": "string",
          "description": "The queue the message was consumed from before dead-lettering."
        },
        "attempts": {
          "type": "integer",
          "minimum": 0,
          "description": "Delivery attempts made before dead-lettering."
        },
        "lang": {
          "type": "string",
          "enum": ["php", "go", "python", "java", "dotnet", "node"],
          "description": "Language of the SDK that dead-lettered the message."
        }
      }
    }
  }
}
